{
  "profile": "agentnexus.code-review/1.0-draft.2",
  "message_id": "msg_0004",
  "type": "delivery",
  "sender_id": "did:agentnexus:z6MkReviewerWorker00000000000000000000000000000",
  "receiver_id": "did:agentnexus:z6MkHczjCoordinator0000000000000000000000000000",
  "session_id": "sess_cr_0001",
  "correlation_id": "corr_mr42_head_1a2b",
  "causation_id": "msg_0003",
  "created_at": "2026-09-18T04:17:00Z",
  "run_id": "RUN-ID-2026-09-14",
  "attempt_id": "A1",
  "assignment_epoch": 8,
  "payload": {
    "delivery_id": "del_0001",
    "run_id": "RUN-ID-2026-09-14",
    "attempt_id": "A1",
    "assignment_epoch": 8,
    "input_manifest_digest": "sha256:1f4a2b3c4d5e6f7a8b9c0d1e2f3a4b5c6d7e8f9a0b1c2d3e4f5a6b7c8d9e0f1a",
    "artifact_ref": {
      "artifact_id": "art_report_0001",
      "producer_id": "did:agentnexus:z6MkReviewerWorker00000000000000000000000000000",
      "media_type": "application/json",
      "schema_version": "code_review.report.v1",
      "digest_algorithm": "sha256-bytes-v1",
      "digest": "sha256:6395a6edac10db12b303cccaa6cbedcb4a99e0f3721195de0312cf0d15766316",
      "byte_length": 2704,
      "locator": "vault://default/executions/exec_0001/result.md",
      "access_scope": "maintenance_domain_read",
      "retention_until": null,
      "replaces": null
    },
    "replaces_delivery_id": null,
    "correction_no": null
  }
}
