{
  "profile": "agentnexus.code-review/1.0-draft.2",
  "message_id": "msg_0003",
  "type": "assignment_acceptance",
  "sender_id": "did:agentnexus:z6MkReviewerWorker00000000000000000000000000000",
  "receiver_id": "did:agentnexus:z6MkHczjCoordinator0000000000000000000000000000",
  "session_id": "sess_cr_0001",
  "correlation_id": "corr_mr42_head_1a2b",
  "causation_id": "msg_0002",
  "created_at": "2026-09-18T04:01:20Z",
  "run_id": "RUN-ID-2026-09-14",
  "attempt_id": "A1",
  "assignment_epoch": 8,
  "payload": {
    "run_id": "RUN-ID-2026-09-14",
    "attempt_id": "A1",
    "assignment_epoch": 8,
    "accepted": true,
    "input_manifest_digest": "sha256:1f4a2b3c4d5e6f7a8b9c0d1e2f3a4b5c6d7e8f9a0b1c2d3e4f5a6b7c8d9e0f1a",
    "output_schema": "code_review.report.v1",
    "acceptance_mode": "adapter_attested",
    "issuer_id": "did:agentnexus:z6MkLocalAdapter000000000000000000000000000000"
  }
}
