{
  "profile": "agentnexus.code-review/1.0-draft.2",
  "message_id": "msg_0001",
  "type": "review_request",
  "sender_id": "did:agentnexus:z6MkNexusCoordinator000000000000000000000000",
  "receiver_id": "did:agentnexus:z6MkHczjCoordinator0000000000000000000000000000",
  "session_id": "sess_cr_0001",
  "correlation_id": "corr_mr42_head_1a2b",
  "causation_id": null,
  "created_at": "2026-09-18T04:00:00Z",
  "request_id": "req_0001",
  "payload": {
    "request_id": "req_0001",
    "idempotency_key": "idem_gitlab-main_proj_7788_mr42_initial",
    "instance_id": "gitlab-main",
    "project_id": "proj_7788",
    "mr_iid": 42,
    "generation": 3,
    "execution_revision": 1,
    "job_id": "J1",
    "report_id": "R1",
    "base_sha": "1a2b3c4d5e6f7a8b9c0d1e2f3a4b5c6d7e8f9a0b",
    "head_sha": "2b3c4d5e6f7a8b9c0d1e2f3a4b5c6d7e8f9a0b1c",
    "target_sha": "3c4d5e6f7a8b9c0d1e2f3a4b5c6d7e8f9a0b1c2d",
    "impact_artifact": {
      "artifact_id": "art_impact_R1",
      "producer_id": "did:agentnexus:z6MkNexusScanner00000000000000000000000000000",
      "media_type": "application/json",
      "schema_version": "nexus.review_impact.v1",
      "digest_algorithm": "sha256-bytes-v1",
      "digest": "sha256:0123456789abcdef0123456789abcdef0123456789abcdef0123456789abcdef",
      "byte_length": 18456,
      "locator": "nexus://reports/R1/impact.json",
      "access_scope": "maintenance_domain_read",
      "retention_until": "2027-03-18T00:00:00Z",
      "replaces": null
    },
    "review_policy_sha256": "0123456789abcdef0123456789abcdef0123456789abcdef0123456789abcdef",
    "operation": "initial",
    "authority_ref": "authz://hczj/review/req_0001",
    "requested_by": "did:agentnexus:z6MkMaintainer00000000000000000000000000000000"
  }
}
